b_title_statement_t/0,a_title_statement_t/0,imprint_s,title_statement_t/0,gender_s
theories and manifestations /,Social class on campus :,"Sterling, Va. : Stylus Pub., 2011.",Social class on campus : theories and manifestations / Will Barratt.,male
"research, theory, and practice /",Social class and classism in the helping professions :,"Thousand Oaks : SAGE, ©2011.","Social class and classism in the helping professions : research, theory, and practice / William M. Liu.",male
reflections on poetry and social class /,The stamp of class :,"Ann Arbor : University of Michigan Press, ©2006.",The stamp of class : reflections on poetry and social class / Gary Lenhart.,male
"British fiction, fantasy, and social class /",Imperial masochism :,"Princeton : Princeton University Press, ©2007.","Imperial masochism : British fiction, fantasy, and social class / John Kucich.",unknown
,The new encyclopedia of Southern culture.,"Chapel Hill : University of North Carolina Press, ©2012.","The new encyclopedia of Southern culture. Volume 20, Social class / Larry J. Griffin & Peggy G. Hargis, volume editors.",
"gangs, gangsta rap, and social class /",Chicago hustle and flow :,,"Chicago hustle and flow : gangs, gangsta rap, and social class / Geoff Harkness.",unknown
,Social class and changing families in an unequal America /,"Stanford, CA : Stanford University Press, 2011.",Social class and changing families in an unequal America / edited by Marcia J. Carlson and Paula England.,
,Sociolinguistics of style and social class in contemporary Athens /,,Sociolinguistics of style and social class in contemporary Athens / Irene Theodoropoulou.,female
how race and gender impact work and home lives /,The face of discrimination :,"Lanham [etc.] : Rowman & Littlefield, 2007.",The face of discrimination : how race and gender impact work and home lives / Vincent J. Roscigno.,unknown
"essays on race, gender, and literary discourse /",New voices on the Harlem Renaissance :,"Madison [etc.] : Fairleigh Dickinson University Press, 2006.","New voices on the Harlem Renaissance : essays on race, gender, and literary discourse / ed. by Australia Tarver and Paula C. Barnes.",
"essays on gender, race, and culture /","Draculas, vampires, and other undead forms :","Lanham, Maryland, [etc.] : Scarecrow Press, Inc., 2009.","Draculas, vampires, and other undead forms : essays on gender, race, and culture / ed. by John Edgar Browning, Caroline Joan (Kay) Picart.",
"race, gender, and ethnicity in a biopolitical age /",America's new working class :,,"America's new working class : race, gender, and ethnicity in a biopolitical age / Kathleen R. Arnold.",female
"race, gender, and sexuality in contemporary films for children /",Animating difference :,"Lanham [etc.] : Rowman & Littlefield Publishers, cop. 2010.","Animating difference : race, gender, and sexuality in contemporary films for children / C. Richard King, Carmen R. Lugo-Lugo, Mary K. Bloodsworth-Lugo.",unknown
"conversations with black women scientists about race, gender, and their passion for science /",Sisters in science :,"West Lafayette, Indiana : Purdue University Press, cop. 2006.","Sisters in science : conversations with black women scientists about race, gender, and their passion for science / [interviews by] Diann Jordan.",female
race and gender in America's civil courts /,The juror factor :,"El Paso : LFB Scholarly Pub. LLC, ©2009.",The juror factor : race and gender in America's civil courts / Sean G. Overland.,unknown
"teaching with gender, European women's studies in international and interdisciplinary classrooms /",Teaching race with a gendered edge :,"Budapest ; New York : Central European University Press, ©2012.","Teaching race with a gendered edge : teaching with gender, European women's studies in international and interdisciplinary classrooms / [edited by] Brigitte Hipfl and Kristin Loftsdóttir.",
"race, gender, and the transformation of labor from reconstruction to globalization /",Looking south :,"Gainesville, Fla. : University Press of Florida, 2011.","Looking south : race, gender, and the transformation of labor from reconstruction to globalization / Mary E. Frederickson ; foreword by Stanley Harrold and Randall M. Miller.",female
the descendants of Thomas Jefferson and Sally Hemings /,"Modern and postmodern narratives of race, gender, and identity :","New York : Peter Lang, ©2010.","Modern and postmodern narratives of race, gender, and identity : the descendants of Thomas Jefferson and Sally Hemings / Yoriko Ishida.",unknown
"examining commercialization, labor, gender, and race in 21st century sports law /",Reversing field :,"Morgantown : West Virginia University Press, 2010.","Reversing field : examining commercialization, labor, gender, and race in 21st century sports law / edited by Andre Douglas Pond Cummings, Anne Marie Lofaso.",female
"race, gender, sex and modernity in Latin America and the Maghreb /","Performative bodies, hybrid tongues :","New York : Peter Lang, 2010.","Performative bodies, hybrid tongues : race, gender, sex and modernity in Latin America and the Maghreb / Julian Vigo.",male
the play of race and gender in an Afro-Ecuadorian festival /,Kings for three days :,,Kings for three days : the play of race and gender in an Afro-Ecuadorian festival / Jean Muteba Rahier.,unknown
"Considering the Intersection of Race, Gender, and the Needs of Black Female Undergraduates /",Support Systems and Services for Diverse Populations :,"Bingley, UK : Emerald, 2011.","Support Systems and Services for Diverse Populations : Considering the Intersection of Race, Gender, and the Needs of Black Female Undergraduates / edited by Crystal Renée Chambers.",
"race, gender, and violence in pre-Civil War Kansas /",Bleeding borders :,"Baton Rouge : Louisiana State University Press, ©2009.","Bleeding borders : race, gender, and violence in pre-Civil War Kansas / Kristen Tegtmeier Oertel.",male
race and gender in the modern charismatic movement /,It's a new day :,"Tuscaloosa, Ala. : University of Alabama Press, ©2008.",It's a new day : race and gender in the modern charismatic movement / Scott Billingsley.,male
"Suzanne Lacascade, Marita Bonner, Suzanne Césaire, Dorothy West /","Race, gender, & comparative Black modernism :","Baton Rouge : Louisiana State University Press, ©2008.","Race, gender, & comparative Black modernism : Suzanne Lacascade, Marita Bonner, Suzanne Césaire, Dorothy West / Jennifer M. Wilks.",unknown
"race, gender, family, and memory in the postmodern West /",Searching for Yellowstone :,"Walnut Creek, Calif. : Left Coast Press, ©2008.","Searching for Yellowstone : race, gender, family, and memory in the postmodern West / Norman K. Denzin.",unknown
"race, class, and gender in theory, policy, and practice /",Emerging intersections :,"New Brunswick, N.J. : Rutgers University Press, ©2009.","Emerging intersections : race, class, and gender in theory, policy, and practice / edited by Bonnie Thornton Dill and Ruth Enid Zambrana ; foreword by Patricia Hill Collins.",
"African American men's experiences of race, gender, and violence /",Through our eyes :,"New Brunswick, N.J. : Rutgers University Press, ©2010.","Through our eyes : African American men's experiences of race, gender, and violence / Gail Garfield.",female
"race, gender, and resettlement, 1959-1979 /",Questioning the Cuban exile model :,"El Paso : LFB Scholarly Pub. LLC, 2010.","Questioning the Cuban exile model : race, gender, and resettlement, 1959-1979 / Cheris Brewer Current.",unknown
"negotiating and mediating race, gender, and disability within family and schools /",Crises of identifying :,"Charlotte, N.C. : Information Age Pub., 2013.","Crises of identifying : negotiating and mediating race, gender, and disability within family and schools / Dymaneke D. Mitchell.",unknown
"race, class, and gender in the South /",The silencing of Ruby McCollum :,"Gainesville, FL : University Press of Florida, ©2006.","The silencing of Ruby McCollum : race, class, and gender in the South / Tammy Evans ; foreword by Jacqueline Jones Royster ; afterword by Lynn Worsham.",unknown
"identity, race, and gender in Brazil /",The sorcery of color :,"Philadelphia : Temple University Press, 2007.","The sorcery of color : identity, race, and gender in Brazil / Elisa Larkin Nascimento.",male
